season,episode,scene,quote_index,line,extra
8,9,2,36,wanna give me a hand?,[to will]
8,9,2,38,well you look incredible too! you’re just—you’re so fit!,
8,9,2,40,"oh umm, i meant to tell you, ross is coming.",
8,9,2,42,good. and rachel green too.,[will stops suddenly.]
8,9,2,44,is there a problem?,
8,9,2,46,what?,
8,9,2,52,"hey, what are you doing? you gotta save room, you’ve got almost an entire turkey to eat.",
8,9,2,54,all right.,
8,9,2,58,will! from high school.,
8,9,2,60,joey.,[to will]
8,9,2,80,hey sweetie. oh good.,[takes the baking dish from her.]
8,9,2,87,that’s will from high school!,
8,9,2,89,"okay, dinner’s ready!",
8,9,2,93,"oh, so who won?",
8,9,2,96,what?,
8,9,2,105,"uh rachel? rachel, why don’t you sit here? and will you sit way over there.",[breaking it up] [next to joey] [the other side of the table.] [monica sets something on the table and removes the cover. it kinda looks like turkey.]
8,9,2,107,this is chandler’s chicken. this is the turkey.,[laughs] [sets down a huge turkey.]
8,9,2,109,about nineteen pounds.,
8,9,2,121,"apparently you were umm, a little mean to him in high school.",[to rachel]
8,9,2,125,oh will. but you-you’ve worked so hard…,
8,9,2,127,okay.,[chandler grabs the dish from monica and hands it to will who starts dishing out a large helping.]
8,9,3,10,i swear i didn’t. hey! is that why you guys used to go up to your bedroom and lock the door? ross and,[to ross and will]
8,9,3,12,"hmm, a little relieved, i gotta say.",
8,9,3,29,you started that?!,
8,9,3,31,everyone at our school heard it!,
8,9,3,36,i thought it might be true. and i was afraid that you were gonna cry and then show it to me.,"[joey is now looking at rachel, and since rachel’s standing and he’s sitting down and he’s not looking at her face… you get the picture.]"
8,9,3,41,"joey, you don’t have to finish that.",
8,9,3,49,oh! me too!,
8,9,3,52,that’s not totally true.,
8,9,3,55,"well you-you did start that rumor about ross making out with mrs. altman, our 50-year-old librarian.",
8,9,3,57,it’s true?!!,
8,9,3,70,didn’t she walk with a cane?,
8,9,3,77,"all right, listen you’re just being silly. rachel, even with that rumor you were one of the most popular girls in school and everyone wanted to be like you. one girl wanted to be like you so much she stuffed her pants with a tootsie roll !",
8,9,3,79,"and ross, if it weren’t for rachel’s rumor i mean no one in high school would even know who you were. she put you on the map!",
8,9,3,81,hey! mrs. altman was the kind of woman you could tell she used to be pretty.,
8,9,3,83,hey guys this stuff is just so way in the past. you-you’ve been through so much since then. and right now you’ve got so much more important stuff going on in your life. can’t you just let this go?,
8,9,4,1,"well joey, we’re all…we’re all very proud of you.",
8,9,4,7,"yeah, you want some?",
8,10,1,0,hey! so what do you think?,
8,10,1,2,"yes! now, they’re a little more than i normally spend on boots…or rent",[shows him the receipt.]
8,10,1,4,i know.,
8,10,1,6,"i’m sorry, they just, they just look so good! and the saleswoman was looking at me like, ""oh, these are way too expensive for you.""",
8,10,1,9,hey.,
8,10,1,11,they’re mine!,
8,10,1,14,"honey, i’m not returning them. okay? i mean i-i know they cost a lot, but i’m going to wear them all the time. you’ll see. besides, i love the compliments. i mean, have you ever had something so beautiful everyone wanted it?",
8,10,1,16,nice try; i’m keeping the boots.,
8,10,3,0,hey guys!,
8,10,3,3,hey.,[sits down on the arm of the couch.]
8,10,3,5,"see chandler? i’m getting a lot of use out of them already! they’re very practical. see, you can wear them with dresses, with skirts, with pants…",
8,10,3,9,they hurt so much!,[almost crying]
8,10,3,11,the guy who made these hates feet and wants to see them die!,
8,10,3,13,"i can’t! i spent so much money on them and i told chandler that i’d wear them all the time, i just can’t give them away!",
8,10,3,15,i can’t do that either! the soles’ are already a little scuffed up and the insides are filled with my blood.,
8,10,5,0,ahhhhhhhh!,[standing up]
8,10,5,2,oh nothing i’m just—just was yawning.,[mimics the groan from before and stretches.]
8,10,5,4,"honey, we don’t really have to go to this thing tonight do we?",
8,10,5,6,i-i don’t-i don’t think that i’m gonna wear the boots tonight.,
8,10,5,8,"well y’know, i’m just-i’m just worried that bosses will see them and think they pay you too much money. or! or your assistant will see them and-and want a raise!",
8,10,5,10,"anyway, i picked up this outfit that i want to wear and the, and the boots don’t really go with it.",
8,10,5,12,"fine! if you want me to wear the boots, i’ll wear the boots. in fact, i’ll go into my room right now and y’know try the outfit on.",
8,10,5,14,okay? ooo wee! christmas party in my boots!,[she starts to walk which causes her to start crying] [runs into the bedroom and mixes saying ‘ow’ with laughing.]
8,10,8,1,yeah! i didn’t know there would be dancing. that was a fun surprise!,
8,10,8,3,"oh no, we can’t walk!",
8,10,8,5,hey! do you think that we can get to the subway right there if we climb down through the manhole cover?,
8,10,8,7,i can’t walk. okay? okay? these boots were a huge mistake!,
8,10,8,9,"okay you were right! all right, i never should have bought them! they’re killing me! one toe at a time!",
8,10,8,11,how are we gonna get home? maybe a piggy-back ride?,
8,10,8,13,"okay. wait, just give me a second, i need to just get my boots off first. ah…ooh…oohh…ohh…oh god…ohh…oh…ohh…ohhhh…",[she starts taking them off.]
8,10,11,1,oh wait! stop! stop! stop!,[notices something in the window]
8,10,11,3,my boots in tan! hey! can you get a little closer so i can see the price?,
8,10,11,5,"okay, i’m sorry. i think i can walk the rest of the way now. just-just give me my boots.",
8,10,11,7,well i don’t have them either. where are they?,
8,10,11,9,"okay. god well, we gotta go back and get them!",[she gets off him.]
8,10,11,11,"okay, i’m never gonna wear them again. i just didn’t get a chance to say goodbye.",
8,10,11,13,okay. all right.,[climbs back on his back.]
8,10,11,15,bye boots—wait! half off?!,[to the boots] [chandler runs off.]
8,11,3,2,"yes, hi.",
8,11,3,6,no leg-chewing for us sir.,
8,11,3,8,i can’t think of anything we’re doing. why can’t i think of anything we’re doing?,[quietly]
8,11,3,10,"okay, i’ll see you tomorrow! just so you know, we’re not seeing him tomorrow. i-i cannot spend another evening with that man. do you remember how he behaved at our wedding?",[doug exits.] [chandler wonders why.]
8,11,3,12,that’s because he wasn’t invited because of the way he behaved at our engagement party.,
8,11,6,4,why did you do that?,
8,11,6,6,"oh yeah, the evander holyfield phase. oh man you were so hard up you practically came on to me.",
8,11,6,8,"hey, i could’ve had you if i wanted you.",
8,11,6,14,you and mona are doing a holiday card together?,
8,11,6,20,like asking her to move in with you?,
8,11,6,22,making her a mixed tape?,
8,11,6,26,"all right. have you said, ""i love you?"" you could say, i love you.",
8,11,6,29,that is a slap in the face.,
8,11,9,8,hi roger.,
8,11,9,16,"rachel umm, i was just talking to this guy and i think he’ll have sex with you.",
8,11,12,1,from the tequila factory?,
8,11,12,3,come here. i can breath through my mouth.,
8,11,12,5,"i promise. hey, speaking of together, how about we send out a holiday card this year?",
8,12,1,4,i love it! it’s huge!! let’s open it! open it!!,[interrupting] [monica rips open the paper.]
8,12,1,6,oh my god!,
8,12,1,8,"oh well, maybe we can put it in the guest bedroom.",
8,12,1,10,all right.,[he goes to push it and it doesn’t move.]
8,12,1,13,"are you kidding?! i practically spent my entire childhood at the arcade! this is like—oh my, this is like my second favorite game!",
8,12,1,15,well i-i really don’t remember the name of it.,
8,12,1,17,"well, you just—you put a quarter in and y’know pull-pull some handles and win like a candy bar or something.",
8,12,1,19,don’t feel bad for me! i won like every time!,
8,12,3,1,"okay, i’m next. don’t! don’t start another game! i said i’m next! phoebe!",[phoebe starts another game.]
8,12,3,3,chandler! phoebe’s hogging the game!,
8,12,3,5,you only think it’s stupid because you suck at it.,
8,12,3,8,"no! no-no! i love it! it is a great present! in fact, why don’t you go home and wait for the thank you card?",
8,12,3,11,"okay. phoebe that’s it. come on, get out—out of the chair. get out! oh come…phoebe!","[she goes to move phoebe, but phoebe goes limp and monica can’t move her.]"
8,12,8,0,hey.,
8,12,8,2,well it clearly wasn’t showering or shaving.,
8,12,8,4,"wait a minute, you stayed home all day and played ms. pac-man while i went off to work like some kind of chump?!",
8,12,8,6,what is the matter with your hand?,
8,12,8,8,"chandler, why would you do that?",
8,12,8,10,you think this is clever?,
8,12,8,12,"hey wait a minute, this one isn’t dirty.",
8,12,8,14,"ah, well if you don’t clear this off, you won’t be getting one of those from me. but ben’s coming over here tomorrow to play this game, this can’t be there.",
8,12,8,16,chandler! he’s seven; he’s not stupid.,
8,12,8,18,"all right, look i’m just gonna unplug it.",
8,12,8,20,honey you-you got to beat your scores!,
8,12,8,22,"all right fine. fine, i’ll do it. i’ve just got to get this off the screen. carol and susan are still upset that you taught him pull my finger.",
8,12,11,0,"okay, i got that. i’ll escape over there. i’ll come back over here. all right, come on ms. pac-man . it’s got—right— well, you’re just a little bitch, aren’t you?",[she dies.]
8,12,11,2,they’re all chandler.,
8,12,11,5,but ben is coming over tonight and he can’t see this.,
8,12,14,0,"oh my god phoebe, you’re on fire!",
8,12,14,4,don’t touch her!!,
8,13,2,0,hi.,[airily]
8,13,2,2,i just had the most amazing bath.,
8,13,2,4,"wait, you like them with me.",
8,13,2,6,"oh, baths are so relaxing!",
8,13,2,8,"how dirty do you think i am? i’m telling you, if you had some candles and some bubbles and some music, you would love it! it would take all of your stress away.",
8,13,4,1,"boy, do i have a surprise for you!",
8,13,4,3,"no, but someone’s really not going to get over that idea, are they?",
8,13,4,5,i drew you a bath!,
8,13,4,7,"please, could you just try it for me? come on, i used all my best stuff! i-i-i lit some candles. i put on some music. i used bath salts, plus bubble bath! and got you this little plastic navy ship. so it’s a boy bath!",
8,13,4,9,"i swear, if you try it, you will love it!",
8,13,4,11,absolutely.,[chandler runs into the bathroom]
8,13,4,12,bet i know how that discussion’s going to go.,"[cut to chandler laying in the bathtub. "" only time ,"" is playing in the background.]"
8,13,4,14,so?,[entering]
8,13,4,16,"i told you you were a bath person! hey, when you get out, maybe i can give you a facial!",
8,13,6,0,hello?,
8,13,6,2,you know what? i-i think i’ll wait out here.,
8,13,6,4,oh. what’s wrong?,[she goes into the bathroom.]
8,13,6,6,what?,
8,13,6,8,"okay, let’s talk about something else.",
8,13,6,10,"well, i actually had the weirdest conversation with joey. he was talking about rules and right and wrong and…",
8,13,6,12,you did? what was he talking about?,
8,13,6,14,that was a long night.,[groans]
8,13,6,16,"okay, he was talking about rules.",
8,13,6,18,"umm, and looking at people differently.",
8,13,6,20,what did he tell you?,
8,13,6,22,"okay. so you, me and london. looking at people differently. maybe he wants to do what you and i did in london with someone.",
8,13,6,24,wait a minute! he stopped talking the minute phoebe came in!,
8,13,6,26,"and phoebe is his friend, so he thinks that would be breaking the rules!",
8,13,6,29,just a minute! that’s mrs. tribbiani!,[to chandler]
8,13,6,31,"why would i say anything? that two of our best friends could start the greatest love affair of their lives! and they would have me to thank, and we could all start having babies?",
8,13,6,33,you just stay here!,[dumps a jar of bath salts in the bathtub]
8,13,6,36,"oh, you had that?",
8,13,6,38,"i thought i lost it. i got a new one, like, a month ago.",
8,13,6,41,nothing.,
8,13,6,43,"i mean, i-i, i really shouldn’t say. i mean, i’m really not supposed to.",
8,13,6,45,it’s a humdinger!,
8,13,6,47,somebody likes you!,
8,13,6,49,no!,
8,13,6,51,it’s joey!,
8,13,6,53,is it something you’d be interested in?,
8,13,6,55,"i guess that makes sense. so, you think you’re going to talk to him?",
8,13,6,57,"not chandler, just joey.",
8,13,10,0,hey.,
8,13,10,2,"yeah, i’m going to take a bath. i’m just going to get a magazine.",
8,13,10,4,what do you think you’re doing?,
8,13,10,6,"i know that you’re new at this, but this is completely unacceptable bath decorum.",
8,13,10,8,"fine, you can have the bath, but i am taking your boat. now you’re just a girl in a tub!",[phoebe enters the bathroom]
8,13,10,12,she pulled it out of me! she’s like a conversational wizard! how’d it go?,
8,13,10,14,what?,
8,13,10,16,i don’t think i’d care.,[pause]
8,13,10,23,"oh my god! a friend he’s looking at differently, but it’s wrong. it’s rachel!",
8,13,10,28,"honey, cover it up with the boat!",
8,13,12,0,"it sure is nice to do this together, isn’t it?",
8,13,12,2,i’m not touching you.,
8,13,12,4,it’s the salts.,
8,13,12,6,"whatever keeps you off the balcony, big guy!",[to herself]
8,14,1,0,"hey, what’s up?","[opens the door wearing a robe, but leaves the chain on]"
8,14,1,2,"oh, okay. no problem.",
8,14,1,4,okay.,
8,14,1,6,here you go.,
8,14,1,8,okay.,
8,14,1,10,what?!,
8,14,1,12,phoebe! you kinda caught me at a bad time.,
8,14,1,14,yes! exactly.,
8,14,1,16,no.,[laughs] [closes the door as chandler walks up.]
8,14,1,20,"phoebe, i can explain!",
8,14,1,24,"well umm, alexandra has been…",
8,14,1,26,"phoebe, don’t get upset!",
8,14,3,1,hi honey. we just got a wedding gift from bob and faye bing; they don’t like us do they?,[they gave them a pok-a-dotted punch bowl.]
8,14,3,3,"no, it doesn’t say where it came from. where would we return it?",
8,14,3,5,why don’t we just find a place for it?,
8,14,3,7,no! that’s where we keep the canned goods! have you completely forgotten everything you learned at orientation?,
8,14,3,9,"oh, okay. here, why don’t you let me do it?",
8,14,3,11,no reason. i-i keep private things in there.,
8,14,3,13,feminine stuff.,
8,14,3,15,"chandler, there is nothing in there that concerns you! if you love me you-you’ll let it go.",
8,14,3,17,thank you!,[he tries the door again and monica glares at him.]
8,14,3,22,well it’s…i mean i’d just—i’d be self-conscious. you’re my friend; i’d be naked.,
8,14,3,24,"that’s different, we were roommates! and when?!",
8,14,3,26,"hey, come on phoebe, you can understand why this would be weird for me.",
8,14,3,28,"okay, if it means that much to you…",
8,14,3,30,dinosaurs.,
8,14,5,1,yes.,[phoebe turns on some music and grabs some oil.]
8,14,5,3,nice! wow phoebe you are good!,
8,14,5,5,no. ooohh…,
8,14,5,7,oh. oh yeah! ohhhhh! ohh! oh yeah!,[in a sexy voice]
8,14,5,9,oh god phoebe!! oh that’s it! that’s it! right there! oh! ooooh-oooh-ooooh…,[phoebe covers one ear.] [tries to cover the other ear.] [covers both ears and continues the massage with her elbows.]
8,14,9,0,hey.,
8,14,9,2,"i gotta tell you, yesterday was amazing. that massage felt so good!",
8,14,9,4,"so umm, what do you say we make it a weekly appointment?",
8,14,9,6,okay.,
8,14,9,8,what?,
8,14,9,10,what’s going on?,
8,14,9,12,what?,[laughs.]
8,14,9,14,what?! you’re crazy! there’s nothing sexual about the noises i make!,
8,14,9,16,"oh my—this is so embarrassing. oh my god, i’m never gonna get massaged again!",
8,14,9,18,really?!,
8,14,9,20,are you sure?,
8,14,9,22,i guess.,
8,14,11,1,how did you get in there?!,[entering] [gasps]
8,14,11,3,oh no! you weren’t supposed to see this!,
8,14,11,5,"no chandler, you don’t understand! okay! okay! okay! fine! now you know. okay? i’m y’know…i’m sick.","[chandler starts singing the theme for sanford and son , an old tv show starring redd fox.]"
8,14,11,7,really? you promise you won’t tell anyone?,
8,14,11,9,well…it’s just umm…i’m afraid you might mess it up.,
8,14,13,0,ohhh.,
8,14,13,2,ohh. oh! ohh!,
8,14,13,4,oh god!,
8,14,13,6,oh yeah right there!,
8,14,13,8,uh phoebe?,
8,15,2,9,"phoebe, c’mere. i want to show you something in the bathroom.",[entering with something behind her back]
8,15,2,12,nothing. just something i want to get phoebe’s opinion on for valentine’s day.,
8,15,2,14,not really.,
8,15,2,16,"all right, big brother. which of these do you think would make your little sister look hotter, so your best friend would want to do her?",[holds up two erm…revealing articles of clothing]
8,15,4,1,"okay! i’ll be right out. i’m slipping into something a little less comfortable, and a little more slutty.",[from her bedroom]
8,15,6,0,so what do you think?,[entering from her bedroom] [referring to her outfit] [chandler glances up at monica with his mouth still wide open and his eyes still huge]
8,15,6,1,i’ve still got it!,[to herself]
8,15,6,3,what is it?,
8,15,6,5,"is this the video of the baby being born? sweetie, this is phoebe’s. why were you even watching it?",
8,15,6,7,"chandler, if you thought i was going to get you porn for valentine’s day… you were right! apparently, it’s about a young girl who moves to the big city, you know, in search of stardom, but ends up having sex with a lot of guys! yeah, it got four starts! oh, wait a minute. those aren’t stars. anyway, you want to take a look?",[pulls a video out of a basket] [looks closer]
8,15,6,9,"honey, what’s going on?",
8,15,6,11,mm-hmm.,
8,15,6,13,"chandler, we can’t let this tape wreck valentine’s day!",
8,15,6,15,"child-birth, it’s a natural thing! it’s beautiful.",
8,15,6,17,"oh! oh, my god! no wonder my mother hates me!",
8,15,6,19,don’t touch me!,
8,15,11,0,how long has it been this time?,
8,15,11,2,that’s better. 90 seconds is a long time not to think about it…except all i did was think about it.,
8,15,11,4,"okay, well, we have to get past this! why don’t we get rid of the tape and pretend it never existed?",
8,15,11,6,okay.,[chandler takes the tape and sticks it under the chair cushion]
8,15,11,8,"oh, thank god!",
8,15,11,10,come in!,
8,15,11,12,"oh, my god.",
8,15,11,15,"rach, you know that birthing tape you wanted to see? it’s here.",
8,15,11,20,"no, but i will leave a sweater that smells like me right next to you!",
8,15,11,22,"she’s right…of course not. honey, get the tape.",
8,15,11,26,it’s…still beautiful.,
8,15,11,28,"i know! i know, i’m so sorry for you!",
8,15,11,33,"oh, look at those little fingers and toes!",
8,15,11,35,oh…rach!,
8,16,3,0,hey.,
8,16,3,2,"i just talked to joey, i just—i want to see how you were.",
8,16,3,4,"all right, i know you’re hurting, and-and i want to be supportive, but don’t say that again.",
8,16,3,6,"honey, i don’t think that’s something we need to worry about! first of all he’s-he’s never gonna tell her how he feels about her. and even if he did you have no idea how she’d react.",
8,16,3,8,joey…he’s not even thinking about going after rachel!,
8,16,3,10,"no! all he’s thinking about is how you’re taking this! i mean, listen it’s totally freaking him out. he’s talking about moving to vermont.",
8,16,3,12,he says he wants to leave the country. he thinks you hate him.,[pause]
8,16,3,14,"honey i can’t even imagine how hard this must be for you. but, i don’t want you to lose joey over it. and right now he just needs to know that you’re still his friend.",
8,16,3,16,"all right. now do it soon, he just asked me how to convert his dollars into vermont money.",
8,16,4,1,hi!,
8,16,4,7,"so, what have you guys been doing?",
8,16,4,9,"i know! what is this, 1985?!",
8,16,4,11,not really.,
8,16,4,13,"so don, what-what other restaurants do you like?",
8,16,4,15,"oh my god! that’s my restaurant, i’m the chef there.",
8,16,4,17,no!,
8,16,4,19,"oh, i’d like a latte. oh y’know what? if you’re gonna talk about me, i’m gonna go with you.",[they go over to the counter and chandler moves closer to phoebe.]
8,16,4,24,"phoebe, good work.",[returning]
8,16,4,26,"yeah! oh he’s great, i love him.",[walks away and chandler glares at phoebe.]
8,16,6,5,"me too! yeah, chandler can’t stand it. he won’t even allow me to have blue cheese in the house.",
8,16,6,7,"you know what i’d love to do? i would like to go to france and eat nothing but bread and cheese—not even bread, just cheese. no, i want the bread. yeah. ah, and pastries… and pate. oh, i’m really not high, it’s just i used to be fat.",[breathlessly]
8,16,6,11,i’d move in tomorrow!,
8,16,8,0,i’d like to have don and phoebe over. wouldn’t that be nice?,
8,16,8,2,are you okay? you’ve been acting weird all afternoon.,
8,16,8,4,jeez! what is with you?,
8,16,8,6,"all right, what’s going on?",
8,16,8,8,"chandler, you don’t believe in soul mates?",
8,16,8,10,i don’t believe in soul mates either.,
8,16,8,12,no. i don’t think that you and i were destined to end up together. i think that we fell in love and work hard at our relationship. some days we work really hard.,
8,16,8,14,"no, i’ve had second thoughts about that. do you realize how hard that would be to clean?",
8,16,8,16,i know.,
8,17,1,2,"joey, you have to talk to her!",
8,17,1,6,hey rachel!,
8,17,1,9,i don’t see him. hey! maybe he’s in the sugar bowl! joey? nope!,[opens the sugar bowl] [closes the sugar bowl and they both laugh.]
8,17,1,11,what’s up?,
8,17,1,13,we were playing a game.,
8,17,1,15,sure.,
8,17,1,18,"okay, did you hear that?",[to joey]
8,17,1,20,"honey, you gotta talk to her.",
8,17,1,23,"hello? no rejection? i got shot down at fat camp! boy, kids are mean when they’re hungry.",
8,17,1,25,"this is rachel. i mean, what are you gonna do, never going to talk to her again? i mean i know it’s weird, it’s awkward, but you gotta at least try.",
8,17,2,3,"okay, i’m done. read mine.",
8,17,2,5,i-i’m the head chef. i-i can’t get promoted.,[stunned]
8,17,2,15,you mean your pink shirt?,
8,17,2,17,"no, i-i haven’t seen your pink shirt.",
8,17,2,29,tea gives phoebe the trots.,
8,17,3,4,"honey, what is the bruce springsteen cd in the kat stevens case?",
8,17,3,6,"okay, where is the kat stevens cd?",
8,17,3,8,where is the james taylor cd?,
8,17,3,10,"okay. no need to panic. deep breathes everyone. okay umm uh, we’re just gonna have to spend some time and put the cds in the right cases.",
8,17,3,12,"hmm, i don’t know. we really have to talk this through.",
8,17,3,14,"okay, i-i’m sorry. you and joey, your both focusing on this uncomfortable thing, what you need to do is to change the subject. next time you see him try to get him talking about something else.",
8,17,3,16,"yeah, like i don’t know, maybe you have a work problem that you need his advice on.",
8,17,3,18,"good. uh honey, the miami vice soundtrack? really?",[to chandler]
8,17,3,22,"uh i really don’t know what to tell you rach, i really don’t. i mean, maybe joey can help you out with your, with your big work problem.",
8,17,3,24,"yeah joey she’s…rachel’s got this really big work problem, and it is a head scratcher. wow! y’know what, if we’re gonna make dinner we’re gonna have to leave. yeah.",[to chandler] [she and chandler exit.]
8,17,6,1,"honey, both yours.",
8,17,6,3,yeah? the work problem?,
8,17,9,9,what?!,
8,17,9,14,you said your boss wants to buy your baby?!,
8,17,9,20,chandler has two copies of annie !,
8,17,12,1,that’s not your regular dry cleaners.,
8,17,12,3,what?!,
8,17,12,5,"don’t worry phoebe, you’re gonna meet someone. if i can meet a great guy, so can you.",
8,17,12,8,are you kidding? this is where they get out stains! okay? this is like disneyland for me. i’m-i’m gonna be over here watching the dance of the clean shirts.,[she points to and walks over to the electric clothes rack they have.]
8,17,12,18,"ooh, an ink stain! hey, can i watch how you get this out?",[to the clerk]
8,18,1,1,yeah.,
8,18,1,7,"oh, by the way. would it be okay if i gave the toast to mom and dad this year?",[to ross]
8,18,1,9,"yeah, i’d really like to.",
8,18,1,11,"yes! every year ross makes the toast, and it’s always really moving, and always makes them cry. well this year i’m going to make them cry.",
8,18,1,13,"no! really! any time ross makes a toast everyone cries, and hugs him, and pats him on the back and they all come up to me and say, ""god, your brother."" know what they’ll say this year? ""god, you""",
8,18,1,15,really you can do that?,
8,18,2,1,"oh i’m working on my toast for the party, or as i like to call it. sob fest 2002. hey check this out.",[hands him a picture.]
8,18,2,3,it’s a dead dog. that’s chi-chi; she died when i was in high school.,
8,18,2,5,"the good stuff, huh?","[ross, joey, and rachel enter]"
8,18,2,9,you got a present for my parents. that’s so sweet.,
8,18,2,16,what?!,
8,18,2,28,that’s my old dog. he passed away years ago.,
8,18,2,30,it’s out on the island. it’s in massapequa.,
8,18,2,32,"okay, i got my note cards. do you got the presents?",[to chandler]
8,18,2,34,and i’ve got the car keys.,
8,18,2,36,yeah.,
8,18,3,41,he called the long island expressway a concrete miracle.,
8,18,3,46,"it’s just that, it’s so much.",
8,18,3,48,i feel terrible.,
8,18,4,30,just going over my toast. those two will never know what hit ‘em. i can’t wait. they’re going to be crying so hard. they’re going to be fighting for breath.,
