season,episode,scene,quote_index,line,extra
3,15,9,16,what do you want me to do? just sit here silently while you three have a conversation?,
3,15,13,1,oh. can i have a tissue?,[to phoebe]
3,15,13,7,"hey, the man’s dog just died.","[sergei insults mischa, and they get into a huge fight, in russian.]"
3,15,13,9,it will be my pleasure. my guy has diplomatic coupons. your guy can’t even say coupons.,[to phoebe] [they leave]
3,16,1,0,hey.,
3,16,1,2,how’s the big anniversary dinner?,
3,16,1,4,"ohhh, nice.",
3,16,1,6,what?!,[she accidentally starts the blender without the lid on it and fruit flies everywhere.]
3,16,1,8,"that’s okay, this is more important than fruit on my ceiling! you broke up?!",[pause] [angrily]
3,16,1,10,oh no!!,
3,16,1,12,"rachel, you and mark?!",
3,16,4,1,hey.,
3,16,4,3,"oh, there’s banana on it.",
3,16,4,5,so then you know?,[phoebe nods her head]
3,16,4,7,"oh, good. thanks.",
3,16,4,9,"okay, all right don’t judge me to much. okay? um, but i saw this info-mercial, and um, i swear to you i have never-ever bought anything on tv before, except for this mop. but there was this stuff on leg waxing, it just, it looked so amazing....",
3,16,4,11,yes! have you seen it?,
3,16,4,13,i know!!,
3,16,4,15,hello! organic substances recently discovered in the depths of the rain forest!,
3,16,6,1,did that!,
3,16,6,3,okay. ow!!!!! ow-oh-oh!,[does so.]
3,16,6,5,"no. it was painful. oh my god , they should call it pain-zine, now with a little wax.",
3,16,6,7,"that’s because their nerves are probably deadened from being so stupid. but hey, y'know if you don’t believe me, please, by my guest.",
3,16,6,9,"now, are you glad we didn’t start with the bikini strips?",
3,16,10,0,ow!,
3,16,10,2,ow!! ow!!,
3,16,10,6,"it’s okay, it’s okay.",
3,16,10,8,we were just waxing our legs.,
3,16,10,17,that’s right.,"[joey laughs, pulls it off, then does a high-pitched whine.] [cut to living room, rachel is trying to close the door on ross.]"
3,16,10,20,what?,
3,16,10,22,rachel said everything was okay.,[going over to listen at the door]
3,16,10,30,oh my god.,
3,16,10,33,oh!! you guys knew about this and you didn’t tell us?!,[hits chandler and joey in the head]
3,16,10,68,"what, what are you doing? you can’t go out there.",[stopping him]
3,16,10,70,because they’ll know we’ve been listening.,[cut to living room]
3,16,10,105,what if they don’t?,[long pause.]
3,16,10,112,hey. it’s three in the morning. they don’t know that i’ve come home yet. you notice how neither one of them are wondering where i am.,
3,17,1,3,guys. i thought you were taking ross to the game?,
3,17,1,5,no! rachel is meeting us here.,
3,17,1,22,it’s never taken you more than a shower to get over a relationship.,[rachel enters.]
3,17,1,23,"okay, let’s go!! let’s hit the road!!",[seeing her]
3,17,1,25,let’s get the show on it!,
3,17,1,27,"oh rachel, i know the best coffee house and it’s sooo close.",
3,17,2,11,we’re sorry honey.,
3,17,2,19,very bad.,[we see chandler lighting up a cigarette.]
3,17,2,21,chandler!!,
3,17,2,27,weren’t you nine?!,
3,17,3,11,"we’re really sorry, but um, she did ask us first.",
3,17,3,15,noo! i’ll stay. he’s my brother.,
3,17,3,17,no! we’re gonna have fun. we can make fudge!,
3,17,4,1,why? do you think he’s still mad at us?,
3,17,4,12,no chandler no! no unscheduled stops. you can go when we stop for gas.,
3,17,5,1,what?,"[both chandler and joey put their feet up against the glass, monica doesn’t and gets thrown up against the glass.]"
3,17,5,3,ow!,[joey gets out and sprints to the bathroom and chandler follows with a cigarette in his hands.]
3,17,5,6,"no, rachel never pees in public restrooms.",[getting out]
3,17,6,3,"so, if you’re parents hadn’t got divorced, you’d be able to answer a question like a normal person?",
3,17,6,5,what?!,
3,17,6,8,please!!,
3,17,6,13,"these tiny, little non-breasts?! please, it’s gotta be rachel.",
3,17,6,15,"all right then, your bra would still be big.",
3,17,6,26,chandler!!,
3,17,8,3,"freemont. west-westmont, ah westburg?",
3,17,8,10,"who? i mean have you seen a car come by here in the last hour and a half? i think we should call ross, maybe he can get a car and come pick us up.",
3,17,8,15,so the going for help went well?,
3,17,8,18,then why are you smoking?,
3,17,9,7,"hey rach, the tampons here are only a penny. let’s stock up.",[running over to stop rachel] [takes her into the bathroom]
3,17,10,1,what’s ‘pleh’?,[reading the sign]
3,17,10,3,huh. what’s doofus spelled backwards?,[ross drives up.]
3,17,10,17,"i know, what about rachel? i mean how are we even gonna ask her?",
3,17,10,19,"umm, if ah, it might be okay if ross came skiing?",
3,17,10,27,here we go again.,
3,17,10,38,i don’t know.,[shyly]
3,17,10,40,"what i said was, was that i understood. joey’s the one who agreed with you!",
3,17,10,61,"all right, we’ll call you when we get back.",
3,18,1,0,what’s so funny?,[to joey]
3,18,1,2,oh.,[she laughs]
3,18,2,25,"yeah, ah, but pheebs don’t you think he’s a little young to get married?",
3,18,2,33,"so, um, how-how did you guys meet?",
3,18,4,0,"and y'know what, i just realised, in the last year i’ve only gone out with two guys, richard and julio. you gotta help me out here, you gotta set me up, you gotta get me back in the game.",
3,18,4,2,"pete, can i get you something else?",[to a customer]
3,18,4,4,haven’t you and i covered that topic?,
3,18,4,6,"aww, the only reason you want to go out with me because my blond wig, and the big boobs, and the fact that i serve you food.",
3,18,4,9,"i mean really, think about it.",
3,18,6,1,"nah, he doesn’t do anything for me.",
3,18,6,4,"well, umm, walker was looking for this big bus load of kids…. all right, i get your point.",[realises]
3,18,6,7,hey.,
3,18,6,9,"uh, yeah.",
3,18,6,15,here you go.,
3,18,6,19,"as a joke, this customer at work who has a crush on me gave me a $20,000 tip. his number is on the check, he just did so i’d call him.",
3,18,6,21,that’s bill clinton.,
3,18,6,23,oh my god! that’s pete! but why is bill huggin’ pete?,
3,18,6,28,i’m not gonna go out with him.,
3,18,6,30,or incredibly offensive.,
3,18,10,4,what the hell is this?,[holding up the check]
3,18,10,6,"seriously, what is this supposed to mean?",
3,18,10,8,"you’re supposed to double the tax. not double the tax of romania. i mean, what’s-what’s the deal? are you, are you trying to buy me? is this the way you get girls to go out with you?",
3,18,10,11,what?!,
3,18,10,13,"okay, umm, you’re a loon.",
3,18,10,15,i don’t know.,
3,18,10,17,‘cause i don’t want to encourage this kind of behaviour.,
3,18,12,2,"guys, please, i’m just gonna have dinner with him. okay?",
3,18,12,4,i know!!,
3,18,12,6,hey!,[opening the door] [to pete]
3,18,12,12,"and that’s why, i’m not inviting you in for a drink. bye.",[starts to leave]
3,18,12,15,"so, where do you want to go?",[in the hallway]
3,18,12,17,"oh, that’s sounds great.",
3,18,13,1,"oh come on, it’s only fair, you paid for the flight. now is, is that enough lire?",
3,18,13,3,"why, how much is that?",
3,19,2,1,"oh, this is so great.",
3,19,2,3,all right then. bye.,"[he leans in to kiss her goodnight, but she quickly kisses him on the cheek and pats his shoulder.] [she goes into her apartment and sees chandler, phoebe, and ross sitting there.]"
3,19,2,4,"hello, people who do not live here.",
3,19,2,6,i gave you a key for emergencies!,
3,19,2,10,"he’s great! i mean we have such a good time together! he’s so funny, and sooo sweet, and i’m not attracted to him at all!!",
3,19,2,12,"noo!! it’s driving me crazy. i mean every other way he’s like the perfect guy, he has everything. plus! he actually has everything.",
3,19,2,14,two.,
3,19,7,12,"absolutely! now get out of here you!! okay, i’m running out of places i can touch him! look, is there something wrong with me? i mean why am i only attracted to guys where there’s no future? either they’re too old, or they’re too young, and then there’s pete who’s-who’s crazy about me, and who’s absolutely perfect for me, and there’s like zip going on! i mean, seriously, does it sound like something’s wrong with me?!","[he goes to kiss her, but she stops him and rubs his head and says...] [pete leaves] [to the gang]"
3,19,12,2,sure.,
3,19,12,4,"well, with all these doctors and nurses, i’m gonna say, midget rodeo.",[looks around]
3,19,12,6,"okay. umm, y'know, i don’t think, i don’t think i told you this, but umm, i just got out of a really serious relationship.",
3,19,12,8,"so i did tell you. okay, y'know, that really isn’t the thing. umm, the thing is that, right now i’m just in a place in my life where i need to focus on me. y'know what i mean?",
3,19,12,10,i so wanna be attracted to you.,
3,19,12,12,i’m sorry.,
3,19,12,14,it’s not?,
3,19,12,16,"well, um, look i-i don’t want this to come our wrong, but ah, you seem awfully confident for a guy i just told i wasn’t attracted too.",
3,19,15,6,"hey, rach, how was work?",
3,19,15,8,"by the way, ross dropped by a box of your stuff.",
3,19,15,10,something wrong?,
3,20,1,2,"wow, you’re really crazy about her, huh?",
3,20,1,8,"yes!! yes! yeah, yeah, yeah!",
3,20,1,12,"oh, she was a cruel, cranky, old bitch! and i’m sorry she died. did dad say i get the dollhouse?",[ross gives her a look] [to ross]
3,20,1,14,i get the dollhouse!,
3,20,1,18,"y'know what, you can play with my dollhouse.",
3,20,1,20,"any time you want. y'know, when i was younger, all i wanted to do was to play with this dollhouse, but no!! it was to be looked at, but never played with.",
3,20,3,0,"look at it! ohhh! wallpaper’s a little faded, that’s okay. carpet’s a little loose. hardwood floors!!",
3,20,3,4,i know!!!,
3,20,3,6,okay.,
3,20,3,8,what’s this?,
3,20,3,10,not one that can pee on the roof.,
3,20,3,14,i don’t want a ghost.,
3,20,3,31,"okay, phoebe, y'know what? that-that’s it, that’s it, all right? no dinosaurs, no ghosts, no giant dogs, okay? they’re not the right size, they’re not victorian, and they just don’t go.",
3,20,5,7,"it’s very interesting, phoebe.",
3,20,5,14,"hey, guys, guys, did you see my new, china cabinet?!",
3,20,8,8,you’re kidding?! that’s great!,
3,20,8,10,oh my.,
3,20,8,17,"come on rach, when a guy says he’s going to call, it doesn’t mean he’s going to call. hasn’t it ever happened to you?",
3,20,8,19,"hmm, bite me.",
3,20,11,1,i’m in the shower!,[from the bathroom] [he closes the door and walks over to get something from the fridge. he starts to smell something and turns around to see phoebe’s dollhouse smoking. he runs over and takes off the roof to reveal that the dollhouse fire.]
3,20,13,1,"oh, that’s okay. by the way, i was just checking the shower massager.",
3,20,13,4,i tried to reach you at work. there’s....been a fire.,[runs over to her]
3,20,13,8,"well, the giraffe’s okay. and so is the pirate.",
3,21,1,1,"oh, some idiot customer put a suggestion in the suggestion box.",
3,21,1,3,that was you?!,
3,21,3,1,"hi! hey, pete you’re back! hey, check this out.",[she starts to skate over to him]
3,21,3,3,wow! you’re a lot sturdier that chandler. he crumpled like a piece of paper. so how was you’re trip?,
3,21,3,5,"oh, what’d ya bring me?! awww, hotel toiletries from japan. oh, these are gonna go in my permanent collection. you want some coffee?",[she opens the gift]
3,21,3,7,regular or decaf?,[popping back up]
3,21,3,9,okay.,[hands him a cup]
3,21,3,11,so what did you do today pete?,
3,21,3,13,what?! oh.,[she turns around quickly and falls]
3,21,4,0,can you believe he just offered me a restaurant?,
3,21,4,2,"i mean this has been like my dream since i got my first easy bake oven and opened easy monica’s bakery. i mean i would kill for this job. i mean i can totally do this job, and god knows i paid my dues. but pete’s just doing this because he has a crush on me.",[she removes her fake breasts]
3,21,4,4,"hmm, no. i mean how can i accept a restaurant from him? i-i-i-i can’t. i couldn’t even accept a necklace from stu vincent in the seventh grade.",
3,21,4,6,"oh, please.",[she slaps rachel’s side and rachel screams in pain.]
3,21,4,7,what? honey.,
3,21,4,9,"oh god, i’m so sorry.",
3,21,4,12,oh god!,
3,21,4,20,oh absolutely. i like it even more on you than i did on colonel sanders. ross! ross! i’m kidding!,[ross starts to leave]
3,21,4,22,what-what was it you were gonna tell us?,
3,21,6,1,okay. here’s the thing.,
3,21,6,3,"i can’t do it. i’m sorry, i wish i could, but umm, see you have these feelings for me....",
3,21,6,5,huh?,
3,21,6,7,oh?,
3,21,6,9,"oh, that’s great! i mean i’m-i’m sorry, but i’m so happy for you. and now i can work for you!",
3,21,6,11,"oh my god! oh, this is incredible! ohh! all right, y'know what? i’m just gonna roll right into that office and-and quit!",[she rolls over and kisses him on the cheek]
3,21,6,13,okay. can you give me a little push?,[she gets ready to go]
3,21,6,15,i’m quitting!! woo-hoo! i’m okay!! i’m all right!!,"[rolling towards the office] [she rolls through a doorway and out of sight. we then hear a big crash, and see monica roll past the door the other way.]"
3,21,10,0,hey!,
3,21,10,2,"hey, guess what i’m doing tonight.",
3,21,10,4,i’m checking out the restaurant with pete.,
3,21,10,6,i know.,
3,21,10,8,what?,
3,21,10,10,"okay, but wouldn’t it be easier if you had to tell me something that you could tell me.",
3,21,10,12,okay. does it have to do with ross and rachel?,
3,21,10,14,does it have to do with joey?,
3,21,10,16,does it have to do with-with chandler and that sock that he keeps by his bed?,
3,21,12,0,does it involve travel?,
3,21,12,2,does it involve clogs?,
3,21,12,4,clogs.,
3,21,12,6,claws?!,
3,21,12,8,"okay, so it doesn’t involve ross or rachel or chandler or joey. but, what about pete?",
3,21,12,10,what is it?! what about pete?,
3,21,12,12,"okay, i feel like i’m talking to lassie. all right, phoebe would you just tell me!",
3,21,12,14,"okay, i gotta go.",[gets up]
3,21,12,16,"okay, does it involve something to do with pete’s computer company?",
3,21,14,0,"i don’t believe this! wow, look at this refrigerator! it’s gigantic! i mean i could live in this thing! i’d be cold, but i’m always cold. oh my god, look at these spider burners! i love spider burners.",
3,21,14,2,"oh, it is sooo perfect. thank you so much.",[runs over and hugs him]
3,21,14,4,did you just smell my hair?,
3,21,14,6,oh god.,
3,21,14,8,you still have feelings for me don’t you?,
3,21,14,10,pete.,
3,21,14,12,"no, it’s not bad. it’s not bad at all. it’s-it’s really nice.",
3,21,14,14,"you may be okay about getting hurt, but i am not okay with being the one who hurts you. that’s why i can’t take this job.",
3,21,14,16,"and well, we probably shouldn’t see each other anymore. i’m sorry.",
3,21,14,18,"okay, bye.","[she kisses him on the cheek, and he kisses her back on the mouth.]"
3,21,14,20,"all right shut up for a second and let me just see something. oh, wow!","[she kisses him back on the lips] [they then hug and kiss, very passionately.]"
3,22,1,11,i need two. i’m bringing pete. my boyfriend. i have a boyfriend now!,
3,22,1,14,really? who’s number two?,
3,22,1,27,bye-bye!,[ross exits]
3,22,1,32,"joey, what are you doing?! it’s never gonna happen, she’s seeing somebody.",
3,22,2,0,here you go. you can wear this.,[to phoebe] [hands her a sweater]
3,22,2,2,uh-huh.,
3,22,2,4,phoebe?,
3,22,2,6,"all right. honey, that’s-that’s a sleeve. okay?",
3,22,2,8,and! we also have speaker phone.,[she turns on the speaker phone.]
3,22,2,10,"okay, wait, you gotta hang up ‘cause we’re gonna be late.","[phoebe starts to hang up the phone, but…]"
3,22,2,14,of course not.,
3,22,4,1,there’s our star!,
3,22,4,7,hi!,
3,22,4,20,"yeah, and in the long version, i dump him for telling people the short version.","[cut to joey as estelle, joey’s agent, approaches]"
3,22,5,0,hey!,
3,22,5,3,yeah. where were you?,
3,22,5,5,you were the next caller five hours ago. you must be going crazy.,
3,22,8,1,"pheebs, you’ve been up for 24 hours! go to sleep, honey. th-this isn’t healthy.",[entering from her bedroom]
3,22,8,4,hey! didn’t you have that outfit on last night?,
3,22,8,7,"anyway, how did it go with kate?",
3,22,8,9,"joey, you had the night!",
3,22,8,11,"when two people finally realise their feelings for each other, and-and they talk for hours, and they-they learn all about the other person!",
3,22,8,13,did you like learn about her family?,
3,22,8,15,yes!!,
3,22,8,17,oh!,"[they hug, triumphantly.]"
3,22,9,4,one.,
3,22,9,15,we’re kidding!,
3,22,9,28,"umm, going to the beach. when it stays light real late.",
3,22,13,0,"phoebe, it’s been two days.",
3,22,13,9,what?,
3,22,13,11,oh.,[sarcastic]
3,23,2,32,pete's breaking up with me.,
3,23,2,34,"i just checked my messages, and he said that when he gets back from atlanta, we need to talk.",
3,23,2,36,well that's it. people never say `we need to talk' unless it's something bad.,
3,23,2,38,really?!,
3,23,5,0,"i gotta go water pete's plants. y'know what, if he's gonna break up with me, maybe i won't water his plants.",[starting to get up] [stops]
3,23,5,9,yeah. which one do you like more?,
3,23,7,0,"okay, this is the den. all right, check this out. lights! whoa! all right. less lights! bad lights! lights go away! oh, see you just need to find the right command.","[the lights turn on automatically, but are very bright] [they dim]"
3,23,7,3,"no-no-no, that's a video-phone. but hey guys you're not supposed to be here, so please, do not touch anything.",
3,23,7,7,i know.,
3,23,7,10,"joey, put that down! oh my god! it's pete. okay, get out!! how the hell do you answer a video-phone!","[the phone rings] [steps in front of it, and automatically answers it]"
3,23,7,12,i guess that's how.,
3,23,7,14,"oh it’s umm, good! it's umm, it’s good, just here watering the plants.",
3,23,7,20,"ahh, pete, the other day when you said you needed to talk, umm, just so i know, is it good news or bad news.",
3,23,7,22,"oh no-no-no, it's still me.",
3,23,7,24,"oh, oh, okay umm, so i'll see you soon.",
3,23,7,26,i love you.,
3,23,7,28,"okay. well, it's good news. it's good news.",
3,23,7,31,oh my.,
3,23,7,35,and that's pete's mom. commercial break,[the gang quickly hides again.]
3,23,8,1,"would you stop? we’ve only been going out a couple of weeks, i mean we don’t even know if he’s gonna propose.",
3,23,8,3,"well if-if that’s what it is, then it’s-it’s crazy.",
3,23,10,2,"y'know when girls sleep with guys with weird things on their body, they tell their friends about it.",
3,23,10,5,brides magazines?,
3,23,10,8,"it is so weird, i know what i said, but uh, this morning, i was lying in bed i was, i was imagining what it would be like to say yes. i know it’s a little sudden, and it’s a little rushed, and it’s totally not like me to do something like this, but that doesn’t mean i can’t. right? i mean i’m-i’m crazy about pete, and i know that we want the same things, and when i thought about saying yes, it made me really happy.",[rachel slams the magazine shut in amazement.]
3,23,10,10,i know. i need more pie.,[pause] [goes and gets some]
3,23,10,16,"so then, are you going to dump jason?",
3,23,13,1,"ooh, nice.",
3,23,13,3,"oh, right! i completely forgot about that.",
3,23,13,5,yeah?,
3,23,13,7,wow.,
3,23,13,9,what’s that?,
3,23,13,11,okay.,[not sure of herself]
3,23,13,13,you wanna what?!,
3,23,13,15,what are you talking about?,
3,23,13,17,and i suppose you used a ring designer for that.,
3,23,13,19,my parents will be so happy.,
3,24,1,1,hey.,[entering]
3,24,1,5,"you’re not gonna believe this. okay, so i go over...","[two guys walk over and interrupt her. they’re both names you’ve already heard. one’s billy crystal. yes, that billy crystal from city slickers . the other one is robin williams. yes, that robin williams from mrs. doubtfire .]"
3,24,1,10,"so guys, listen, i go over there, and umm...",[robin interrupts her again by complaining loudly to billy as the camera cuts to them.]
3,24,1,22,i...,[robin is speaking loudly again] [cut to billy and robin]
3,24,1,24,forget it.,[they all turn and listen to billy and robin]
3,24,1,35,i have no idea.,[pause]
3,24,2,2,he didn’t ask me to marry him.,
3,24,2,5,he wanted to tell me he’s gonna compete is some ultimate fighting competition thingy.,
3,24,2,8,i don’t know exactly. it’s-it’s sorta like wrestling.,
3,24,2,10,"yeah, but without the costumes.",
3,24,2,14,"so you can like, bite, and pull people’s hair and stuff?",
3,24,2,16,what’s fish hooking?,
3,24,4,7,"i gotta tell ya, i think it’s okay to be that guy.",
3,24,4,11,"okay, can we please go eat?",
3,24,4,13,anything but stew.,[to chandler]
3,24,5,3,hi!,[entering]
3,24,5,6,"hey, umm, so listen umm, my friends were telling me a little about this ah, ultimate fighting thing and it, well it sounds really dangerous. i-i don’t want you to get hurt, ‘cause i kinda like you.",
3,24,5,8,promise me you’ll be careful.,
3,24,5,10,"hey, are we still on for tonight?",
3,24,5,12,"okay, good, ‘cause umm, well maybe we could have a little workout of our own...",
3,24,5,14,how ‘bout just a boom?,
3,24,8,1,"god ross, what is that?",
3,24,8,4,"i love you, pete!!!",
3,24,8,6,pete! pete!! that guy’s pretty huge!,[going up to the ring]
3,24,9,0,hey! it’s me. mon-i-ca! can i just tell you how proud i am of you.,[she sits down next to him]
3,24,9,2,"i mean i-i thought you were nuts at first, but you-you did it. and now you can just look back at this thing with no regrets.",
3,24,9,4,"well, you’re not gonna get going are you?",
3,24,9,6,"well, no. but...",
3,24,9,8,that guy stood on your neck until you passed out!,
3,24,9,10,you didn’t know that already?,
3,24,9,12,"okay, just get a lot better. fast.",[pause]
3,24,9,14,yeah. that-that was the problem.,
3,24,10,0,hey.,[joining them]
3,24,10,2,"oh, about five minutes. right now they’re interviewing his opponent. apparently he trains by going to iran and pulling the arms off thieves.",
3,24,10,4,"four, please. i’m really nervous. thank you.","[ross looks at her] [ross gives her the four dogs] [she grabs four buns, and heads back inside]"
3,24,13,1,please tell me you’re stopping now.,
3,24,13,3,you are insane! you-you gotta give this up!,
3,24,13,5,"sit down. all right? please, just listen to me. you are terrible at this! okay? you are the worst ultimate fighter ever! ever!!",
3,24,13,7,"well then, y'know what? i care about you to much to watch you hurt yourself like this. so if you have to do this, then you’re gonna have to do it without me.",
3,24,13,9,then i’ve gotta go. bye.,[kisses him and starts to walk out]
3,24,13,11,yes?,
3,24,15,4,really?!,
3,25,1,5,"joey, she was listing the countries she’s done it in.",
3,25,2,0,would you look at them. am i ever gonna find a boyfriend again? i gonna die an old maid.,"[watching a happy couple walk by, arm in arm]"
3,25,2,2,thanks!,[sarcastic]
3,25,2,4,yeah right.,
3,25,2,6,you made a joke right? so i laughed.,
3,25,2,8,"well, no. you’re chandler. y'know, chandler!",[hits him on the arm]
3,25,2,10,well i’d probably be scared of a guy using a fake voice.,
3,25,2,12,"oh, hey! oh good, you brought food!",
3,25,2,23,"seriously, where did you get the hat?",
3,25,3,3,what’s with all this sand?,"[picking a handful of sand off of the floor, which is covered in sand]"
3,25,5,1,what?!,
3,25,5,4,what are you crazy?!,
3,25,5,7,"aww, thank you.",
3,25,5,28,so what’s phoebe like?,[to phoebe]
3,25,5,30,"ah no, the other phoebe, the one you went to go see.",
3,25,5,34,"oh well, where is he?!",
3,25,5,36,totally familiar.,[gasps] [phoebe shows the rest of them.]
3,25,5,39,"well, why would she lie to you?",
3,25,5,50,strip happy days game?,
3,25,5,66,i think i’ll help her out. what is going on here?,"[she gets up to go over and help rachel, and reveals she has no pants.] [to rachel]"
3,25,5,68,you painting his toenails?,
3,25,5,70,chasing him all around the room?,
3,25,5,72,he’s totally flirting with you too.,
3,25,6,1,huh?,
3,25,6,3,you didn’t even take off your pants.,
3,25,6,5,what?,
3,25,6,16,like a log.,
3,25,13,1,that’s that weird voice again.,
4,1,3,0,shoot! we’re out of soda.,[closing the fridge in disgust]
4,1,3,2,really?!,
4,1,3,6,"sweety, what are you talking about?",
4,1,3,11,oh.,
4,1,6,1,ennnh.,
4,1,6,6,ow!! ow!!!,[screaming in pain]
4,1,6,8,"jellyfish sting! oh, it hurts! it hurts!! it hurts!!",
4,1,6,10,it’s like two miles!,
4,1,6,12,oh damn the jellyfish. damn all the jellyfish!,
4,1,6,15,what?! what is it?!,
4,1,6,17,what?!! gross!!,
4,1,6,20,well forget it! it doesn’t hurt that baaad !!!!,[tries to take a step]
4,1,7,3,"nothing, i don’t know.",
4,1,7,5,nothing. i’m gonna take a shower.,
4,1,10,0,"pass the cheese, please.",[joey hands her the cheese without looking at her.]
4,1,10,1,"my god, you can’t even look at me! can you?",
4,1,10,9,"what? we took a walk, nothing happened. i can back with nothing all over me.",
4,1,10,13,"no! joey, we swore we’d never tell!",[stopping him]
4,1,10,16,all right!! all right. i got stung. stung bad. i couldn’t stand. i-i couldn’t walk.,[interrupting] [walks slowly into the living room]
4,1,10,18,i was in too much pain.,
4,1,10,24,"you can’t say that!! you-you don’t know!! i mean i thought i was gonna pass out from the pain! anyway i-i tried, but i-i couldn’t...bend that way. so...",[looks at joey.]
4,1,12,9,you bet.,[cut back to rachel’s bedroom with both of them hurriedly getting dressed]
4,1,12,20,hey!!,
4,1,13,0,gin.,[sets down some cards]
4,1,13,2,will you stop!,
4,1,13,4,"okay, all right, i think you’re great, i think you’re sweet, and you’re smart, and i love you. but you will always be the guy who peed on me.",
4,2,2,1,yesss!!,
4,2,2,3,shhh!,
4,2,2,5,"chip, is chip matthews.",
