season,episode,scene,quote_index,line,extra
6,2,9,7,"i don’t know. hey, rachel, you want the big plate? i want you to have the big plate.",[picks up a big plate from the coffee table.]
6,2,9,9,something to remember me by!,
6,2,9,11,"but still, it’s a big change. the end of an era, you might say!",
6,2,9,13,"i’m fine! i just, i’m thinking how much it’s an end of era.",
6,2,9,15,"an era is defined as a significant period of time. now, it was significant to me, maybe it wasn’t significant to you!",
6,2,9,17,what is the matter with you?!! why aren’t you more upset?! aren’t you gonna be sad that we’re not gonna be living together anymore?! i mean aren’t you gonna miss me at all?!,
6,2,9,19,what’s hard to believe?,
6,2,9,21,"rachel, it’s going to happen. chandler is gonna move in here.",
6,2,9,23,"no-no, wait! just let me finish, okay? this isn’t something that we just, we just impulsively decided in-in vegas, this is something we both really want. and it is going to happen.",
6,2,9,25,"yeah, sweetie.",
6,2,9,27,no.,
6,2,9,29,i’m gonna miss you!,[they hug.]
6,2,9,31,i know!,
6,3,1,9,who’s denise?,
6,3,3,3,"okay listen, y’know when you move in rachel’s room is gonna be empty, you wanna talk about what we want to do with it?",
6,3,3,5,"okay, i was thinking we should have a beautiful guest room, right? with a mahogany sleigh bed and bedside tables with flowers on them all the time! and we could have a roll top desk with comment cards on them so people could say how much they loved staying here!! okay, whatever, i really haven’t thought about it that much.",
6,3,3,7,no.,
6,3,3,9,"oh, i’m sorry. of course i mean that. interesting idea, umm, talk about it, but no.",
6,3,3,11,i just don’t think arcade games go in the beautiful guest room. the beautiful guest room is gonna be filled with antiques.,
6,3,3,13,what do you have against the beautiful guest room?,
6,3,3,15,are you mocking me?,
6,3,7,1,hi.,
6,3,7,3,stop it chandler. i’m sorry too.,[chandler is relieved]
6,3,7,5,yeah! oh yes!,
6,3,7,7,"listen, we don’t have to make that a guest room, we can think of something to do with the room together.",
6,3,7,9,totally!,[they start thinking.]
6,3,7,11,oh good.,
6,3,7,13,changes?,
6,3,7,15,you’re-you’re-you’re gonna bring the barca lounger over here?,
6,3,7,17,"well, it’s a set and they should probably stay together.",
6,3,7,19,see now-now you’re taking them away from their home.,
6,3,7,21,"yeah-yeah, y’know what? yeah, that’s it-that’s it, everything will be mine! nothing will be yours! that’s-that’s what i said! oh come on, chandler! i’m talking about the barca lounger! it just, it doesn’t match! where is it gonna go?!",
6,3,7,23,look it is not my fault that your chairs are incredibly ugly!,
6,3,10,1,"ross, we can handle this.",
6,3,10,6,love is the best medicine.,
6,3,10,8,why do you do it?,
6,3,10,13,yes.,
6,3,12,1,that’s very funny!,
6,3,12,4,"ross, you were right before, it was just a stupid fight about a room.",
6,3,12,7,"yeah, no, me neither.",
6,3,12,9,you still want to move in together right?,
6,3,12,11,ross didn’t scare you?,
6,3,12,13,"come here, i want to show you something!",
6,3,12,16,this is where i thought the barca lounger could go! you see you could see the tv and it’s still walking distance to the kitchen.,
6,3,12,18,okay!,
6,3,12,20,uh-hmm.,
6,3,12,22,oh my god! i love that!,
6,3,12,24,"uh, no!!",
6,4,1,1,this bottle opener.,[she grabs it off of the freezer door.]
6,4,1,3,and it’s a magnet!,
6,4,1,16,"hey rach, aren’t these candlesticks mine?",[holds up a pair]
6,4,1,18,"ohh! yeah, i forgot.",
6,4,1,20,that you’re a liar.,[under her breath] [hides the candlesticks in a drawer.]
6,4,1,22,"wow! uh what, did he uh, say?",
6,4,2,2,hey!,
6,4,2,9,phoebe that’s crazy!,
6,4,4,8,hmm?,[rachel holds up the candlesticks.]
6,4,4,10,"no-no, i-i just, i liked them so much that i went out and bought some for myself.",
6,4,4,12,i loved them!,
6,4,4,15,hey!,
6,4,4,17,how’d the lecture go?,
6,4,4,21,that you’re not funny or sexy?,
6,4,7,1,"yeah, but y’know we could sneak in and watch.",
6,4,8,0,what the hell are you doing?!,
6,4,8,8,monica gellerrr.,[in an irish accent] [she rolls her ‘r’]
6,4,8,10,"oh, you can have an accent and i can’t?! top ‘o the morning to ya laddies!",[normal voice] [to an exiting student in accent.]
6,4,10,0,gimme ‘em!,
6,4,10,2,you stole them from me!,
6,4,10,4,gimme them!,"[with one last mighty tug the combatants lose their grip and split, each holding one candlestick.]"
6,4,10,5,you just wanna each take one?,
6,4,10,9,"why don’t you phase it out? yeah, fade the accent out and people will think you’re, y’know, that you’re adjusting to life in america.",
6,4,10,14,i think you look fine.,
6,4,14,0,"okay, come on, do it one more time!",
6,4,14,2,yes!,
6,5,1,4,you’re kidding!,
6,5,1,6,ross!,
6,5,2,2,"joey, why don’t you put them in the lost and found?",
6,5,2,9,"oh my god, what a fun day! that sounds great!",
6,5,2,14,"don’t worry about it phoebe, we’ll absolutely do it.",
6,5,2,16,"come on chandler, come on! it’ll give us great practice for when— —people with babies come to visit.",[realizes what she’s about to say and changes]
6,5,5,0,"pheebs, how’s it going?",
6,5,5,2,"nope, sound like me. pheebs, it’s going great. look at chandler with little baby girl chandler.",
6,5,5,6,what do you mean?,
6,5,5,10,this is so great! this is exactly how we set the plates at the restaurant.,
6,5,5,20,"oh yeah, i got soap and sponges and rags and carnuba wax and polishing compound.",
6,5,5,22,"i know. but umm, one time there was this really dirty car in front of the building, so i washed it.",
6,5,5,24,and six others.,
6,5,7,1,"yeah, two hours, a lifetime that’s the same.",
6,5,7,3,"chandler, what are you doing? that thing can put someone’s eye out!",
6,5,7,10,oh it’s so cute. i wonder what age it is when you stop being able to put both legs over your head.,
6,5,7,12,how are you still single?!,
6,5,7,14,good. what made you change your mind?,
6,5,7,18,"damnit! y’know this whole time we were concentrating on watching the babies and, and no one was watching chandler!",[he does it again.]
6,5,9,3,and people will think you own a porsche because you’re wearing the clothes?,
6,5,9,8,"joey, you know you don’t actually have one.",
6,5,9,11,"all right, that’s it, we’re going to the emergency room.",
6,5,9,13,"the babies are asleep, i’m sure you’ll be okay on your own for a while!",
6,5,9,15,"he’s got something plastic lodged in his throat, we’ve got to go to the hospital.",
6,5,11,6,oh my god.,
6,5,11,8,"phoebe, what, what happened here?!",
6,5,11,10,but my apartment!,
6,5,11,12,but the mess!,
6,5,11,14,"you’re right, you’re right i shouldn’t freak out. ‘cause this is what will happen when you and i have babies! when will that be?!",
6,6,2,6,hey!,[entering from her room]
6,6,2,8,okay.,[thinks]
6,6,2,10,"well, instead of being sad that tonight is my last night together with rachel we thought we’d go out to dinner and celebrate the fact that rachel is moving in with phoebe.",
6,6,2,12,it’s not your birthday.,
6,6,2,23,you’re not dressed yet?! we’re supposed to start having fun in 15 minutes!,
6,6,2,25,"rachel, you are packed though right, i mean please tell me that you’re packed.",
6,6,2,31,"rachel, i need to borrow— you’re not packed !!!! you’re not packed even a little bit!",[entering]
6,6,2,33,what?,
6,6,2,35,"i’ll be coordinator! oh my god! i’m so sorry, i didn’t get you anything! okay, look everybody has to help! okay? you can help, can’t you phoebe?",[grabs a bag of those styrofoam peanuts]
6,6,2,37,you’re plans were with us.,
6,6,2,39,"all right, chandler can make boxes, ross can wrap, and joey can lift things. now phoebe, go tell the guys they have to help out!",
6,6,2,41,"okay! oh my god, thank you!!","[to rachel] [cut to living room, phoebe enters and closes rachel’s door behind her.]"
6,6,2,43,"okay! the movers will be here in 11 hours. rachel has not packed. now, everybody has to help! chandler, we’re gonna start with…",[entering and interrupting the guy’s escape attempt]
6,6,2,45,i thought you said you were going to do nothing.,
6,6,2,47,"okay fine, now ross…",
6,6,2,49,why not?,
6,6,2,52,"it’s almost 8 o’clock, it’s almost past his bedtime. where-where is he?",
6,6,2,54,is he really coming? because i can see right into your apartment!,
6,6,2,56,"all right, sorry.",[goes back to rachel’s room.]
6,6,4,1,oh god!,[starting to cry]
6,6,4,3,no.,
6,6,4,7,i’m gonna miss you so much.,
6,6,4,9,i don’t think there’s anything.,
6,6,4,11,"nope, she’s perfect.",
6,6,4,16,"aw, sometimes. always, actually.",
6,6,4,18,not just the phone pen. i never get my messages.,
6,6,4,20,"yeah, well i don’t think it really counts if you have to read them off the back of your hand after you fall asleep on the couch.",
6,6,6,0,"hello? oh, hi ross! see? other people call me!",[listens] [to rachel]
6,6,6,2,what’s up?,[on phone]
6,6,6,4,"oh, put him on!",
6,6,7,2,"""hi i’m rachel, is my sweater too tight? no? oh, i’d better wash it and shrink it!""",
6,6,7,5,"""oh my god, i love ross! i hate ross! i love ross! i hate ross!""",
6,6,9,0,i’m not talking to her!,
6,6,9,2,"well, maybe you’re right—she made fun of my phone pen!",
6,6,9,4,"listen rachel, i feel really bad about—what are you doing?",[she sees that rachel is unpacking.]
6,6,9,6,what?!,
6,6,9,8,it needs to go about 20 blocks to the left!,
6,6,9,10,because it’s my apartment!,
6,6,9,11,"well it’s mine too! what else you got?! monica how about, you’re moving!!","[grabs a bunch of clothes and throws them into a box. what follows is a brief sequence of rachel unpacking and monica packing the same stuff over and over again as rachel chants ""no."" and monica chants ""yes.""]"
6,6,9,15,i am not!,[entering]
6,6,9,18,no phoebe i am mad!,
6,6,11,0,"well, this is the last box of your clothes. i’m just gonna label it, ""what were you thinking?""",
6,6,11,6,"whoa-whoa-whoa, phoebe you gotta take her! y’know i-i-i said some really bad stuff about her, but y’know rachel has some good qualities that make her a good roommate.",
6,6,11,8,"y’know she has 147,000 pairs of boots…",
6,6,11,10,she lets you borrow them.,
6,6,11,12,"do you wanna live outside?! because it’s gettin’ cold! she gets tons of catalogs and umm, she’ll fold down the pages of the things she thinks that i’d like.",[to phoebe]
6,6,11,14,"when i take a shower, she leaves me little notes on the mirror.",
6,6,11,17,"when i fall asleep on the couch after reading, she covers me over with a blanket.",
6,6,11,19,"and when i told her that i was gonna be moving in with chandler, she was really supportive. you were so great. you made it so easy. and now you have to leave. and i have to live with a boy!!",[to rachel] [starts to cry] [they both break down in tears.]
6,6,11,24,kinda. oh my god!,"[she hugs phoebe and looks out the window. she moves closer to it to get a better look.] [cut to ross’s apartment, he’s watching tv and eating some popcorn as the phone rings.]"
6,6,13,0,hey. call me when you get there. okay?,
6,6,13,2,i’m really gonna miss you.,[they hug.]
6,6,13,4,thanks.,
6,6,13,7,yeah.,
6,6,13,10,bye.,[monica closes the door and slowly walks into rachel’s old and now empty room.]
6,6,13,12,she really left.,
6,6,13,14,thank you.,
6,6,13,16,can i ask you a question?,
6,6,13,18,what the hell is that dog doing here?!,"[she notices the dog sitting in the living room.] [and with that, an era ends as chandler moves in with monica as rachel moves in with phoebe. it ‘tis a sad and happy time for friends.]"
6,7,2,2,hey! ross and,
6,7,2,4,"honey, that's a great idea nailing the boxes to the floor!",[jumps over a box]
6,7,2,6,"oh, so you can move them!",
6,7,2,13,it's nice to meet you. janine...?,
6,7,2,24,"joey, did you even interview this woman before you asked her to move in?",
6,7,2,26,"uh-huh, what exactly did you ask her?",
6,7,2,30,"oh, so you like her too chandler?",
6,7,2,33,"wait a minute...joey. joey you can't ask her out, she's your roommate. it-it'll be way too complicated.",
6,7,2,41,"yeah and you better watch the flirting too, cause you know, in such close quarters, it could be trouble.",
6,7,2,43,"hmm, well you're around me all the time and you don't flirt.",[chuckles]
6,7,4,3,"did you also have his album, it's not easy being green ?",
6,7,4,5,"so, phoebe runs weird huh?",
6,7,4,7,why don't you just be straight with her? tell her the truth.,
6,7,4,14,i don't know. rachel i'm-i'm sorry that i hurt your ankles.,
6,7,4,16,we'll see.,
6,7,8,14,hi!,[on phone]
6,7,8,16,"terrible. if-if i want something done right, i have to do it myself. other people just wreck stuff. i really think i might kill someone tonight.",
6,7,8,18,it's worse. the only thing that's getting me through is knowing that i'm gonna be seeing you soon. i think i may even try to get out of here early.,
6,7,8,20,"well, are you just hanging out with ross?",
6,7,11,3,what?!,
6,7,11,7,why is ross naked?,
6,7,11,9,naked?,
6,7,11,11,is it the same thing that chandler had?,
6,7,11,13,"okay, listen, there's still some of chandler's medicine under the sink in the bathroom. bye!",
6,7,14,0,is it okay for me to come in now?,
6,7,14,2,why is everything different?,
6,7,14,5,"well, the end table is wrong, the couch looks bizarre and don't even get me started on the refrigerator magnets.",
6,7,14,7,"it's okay. chandler, are you afraid of me or something?",
6,7,14,9,"of course not. i mean gosh, chandler what you did, it's, it's a wonderful thing and i really appreciate it. i know i have this weird thing where i want everything to be in the perfect place, but i'd never expect you to worry about that.",
6,7,14,11,of course!,
6,7,14,13,"all right, hold on okay? first thing's first. okay, now did ross sit anywhere while he was naked?",[gets her cleaning gloves on]
6,8,1,19,chandler come on. we have to hem the new dust ruffle.,
6,8,2,0,hey guys.,
6,8,2,2,it was okay. she’s still kind of depressed because she broke up with her boyfriend.,
6,8,2,5,yeah.,
6,8,2,7,"no, the one who looked at you once because you got in her way.",
6,8,2,23,i don’t think mine likes me either.,
6,8,2,27,we should go.,
6,8,6,1,r and monica hey.,
6,8,6,4,what happened to your teeth.,
6,8,6,8,"well, i think i shouldn’t look directly at them.",
6,8,6,10,"ross they’re really, really, really white.",
6,8,6,13,how much longer?,
6,8,6,15,ross you know that tonight is your date with hillary?,
6,8,6,18,she will be after tonight.,
6,8,6,23,oh my god.,
6,8,6,26,"my god, rachel, i can’t believe phoebe made out with ralph lauren. ohh, i’m so jealous.",[chandler looks at her.]
6,8,6,28,"chandler, please, come on. look at him.","[pointing to a picture of ralph on a magazine,.]"
6,8,7,0,"okay, maybe this will make your teeth look less white. nope. okay, colors that don’t work are blue, yellow, green, red, black, white, orange, and purple.",[holding a shirt in front of ross.] [ross has a big smile.]
6,8,7,2,"hey ross, maybe if your skin was lighter. your teeth wouldn’t look so bright.",
6,8,7,4,"i’m just saying, if we put just a little bit of makeup on you.",
6,8,7,6,ross this is the only thing left that has a shot at working.,
6,8,7,8,please. half the guys out there have makeup on.,
6,8,7,10,"all right, half the people. i mean, just try it and see.",
6,8,8,0,now are drawers will smell nice and we didn’t waste these pantyhose.,
6,8,8,2,"wait, we’re supposed to organize the wrapping paper drawer.",
6,8,8,4,"you know what? this has been kind of a girlie day. you’re right, i’m sorry.",
6,8,8,6,yeah. go over to joey’s. go over to joey’s and drink some beer and hammer up some drywall.,
6,8,8,8,"when girls hang out, we don’t have pillow fights in our underwear. i’m sorry. we do. we do. i don’t know why i said that.",[chandler gets a hurt look on his face.]
6,8,13,1,"oh my god, joey, that is such a great tip.",
6,8,13,3,"okay. oh but joey, come over later because i’m going to teach you to make a bird feeder out of just a pine cone and some peanut butter.",
6,9,1,0,"okay, great! bye. so guess who’s coming to thanksgiving dinner?",[on phone] [hangs up as chandler enters.]
6,9,1,2,"i miss rachel. no, my parents.",[not amused by chandler’s joke] [to chandler]
6,9,1,4,"yeah, and y’know, if you could not mention to them that we live together, that would be great! , i was thinking we would eat around four.",[quickly trying to change subjects] [monica goes to the stove.]
6,9,1,6,because they don’t know we’re dating. do you think we should eat in the kitchen?,"[again, trying to quickly change subjects.] [goes to the sink and the stove to cook.]"
6,9,1,8,"um, well, i was going to, i-i-i really was. but um, then somewhere, just out of nowhere, i didn’t.",
6,9,1,10,so! dinner in the kitchen around four! i’ll see you then.,"[trying to change subjects, excitedly] [pats chandler on the shoulder and goes into the living room.]"
6,9,1,12,"well, um, because mainly, um, they don’t like you. i’m sorry.",
6,9,1,14,"maybe because you used to be aloof, or that you’re really sarcastic, or that, y’know, you joke around all the time. or that you take off your clothes and throw them on the couch.",
6,9,1,16,"look, i know that i should’ve told them. i know i shouldn’t care what they think. i’m sorry.",
6,9,1,18,you really think that’ll work?,
6,9,1,20,i don’t think you’ll ever get my parents that drunk!,[hugging chandler]
6,9,3,4,nothing.,
6,9,3,6,"no, sweetie, i-i trust you.",
6,9,3,8,you’re not gonna mess it up.,
6,9,3,10,"well, it’s done about two minutes before it looks like that. joey and",[joey and ross enter.]
6,9,3,20,whoa whoa whoa! where’re you goin’?,
6,9,3,22,"oh, janine, the really hot dancer girl?",
6,9,3,29,"you’re not gonna go anywhere, you said you were gonna eat here, and you’re gonna eat here!",
6,9,3,36,"dad , mom . look! look who it is it’s chandler!",[kisses jack] [kisses judy]
6,9,3,43,"dad, chandler was just laughing at your joke.",
6,9,3,49,"y’know dad, chandler is one of ross’s very best friends!",
6,9,3,79,"mom, uh, chandler was just saying how beautiful your sweater is.",
6,9,3,85,what?,[shocked]
6,9,5,0,mom and dad just sent me in here to find out if you were trying to get ross stoned!,[points to chandler]
6,9,5,2,"ross, i can’t believe you’d do that!",
6,9,5,5,you! it’s not like it’s a big deal! you-you don’t still do it or anything!,
6,9,6,0,"dad, please don’t pick your teeth out here! alright, and if you’re gonna put your feet up, why don’t you sit on the-",
6,9,6,8,"ross, if you don’t tell them, then i will!",
6,9,7,32,really?,[rachel hands monica a plate. monica takes a spoonful of the whipped cream portion.]
6,9,7,34,okay.,[monica takes a bigger spoonful and a pea falls off]
6,9,7,37,mmmm! it’s good!,"[faking joy. rubbing her stomach and smiling at the same time, like joey said]"
6,9,7,39,"it’s so good, that i feel really selfish about being the only one who’s eating it, that i think we should have everyone taste how good it is. especially ross.",[ross glares at monica.] [everyone takes a bite of their trifle.]
6,9,7,44,"i’m gonna go into the bathroom so i can look at it in the mirror, as i eat it.","[again, lying] [monica exits to the bathroom.]"
6,9,7,60,ross? let’s go.,
6,9,7,62,"alright, you know what? that’s it. you’ve had your chance.",
6,9,7,64,mom! dad! ross smoked pot in college! mr. and,"[out loud, to her parents]"
6,9,7,70,"and dad, y’know that mailman that you got fired? he didn’t steal your playboys! ross did!","[the gellers stare at ross. ross looks at his parents with an afraid, shocked look.]"
6,9,7,72,ross hasn’t worked at the museum for a year!,[the gellers glare at ross.]
6,9,7,74,ross married rachel in vegas! and got divorced! again!!!!,[the gellers glare at ross.]
6,9,8,1,"well actually, i-i didn’t eat mine. it’s still in the bathroom.",
6,10,1,5,having a perfectly decorated tree is not what christmas is about. it’s about being with the people that you love.,
6,10,1,8,"oh, here.","[she turns the tree around so that her side, which is perfectly decorated, is showing]"
6,10,2,7,"aw, i’m sorry sweetie that she doesn’t feel the same way.",
6,10,2,14,hold it! are you talking about dick clark’s new year’s rocking eve ?,
6,10,2,16,oh my god! we love that show! i mean ross and i have been watching it since i can remember!,
6,10,2,26,we are there!,[rachel laughs]
6,10,2,34,what are you talking about? she just invited him to the biggest party of the millennium!,
6,10,2,39,we are going to dick clark’s new year’s rocking eve !,
6,10,2,41,oh my god!,
6,10,5,0,"okay, here comes another camera.",
6,10,5,3,"if we wanna get on camera, i think we have to get up on one of those platforms. they’ve been taping those people up there all day.",
6,10,5,7,oh yeah? well when you learned how to dance did you forget how to put on underpants?,
6,10,7,2,"hey, see that snippy guy over there? he’s the one who decides who gets up on the platform. we should go dance by him.",
6,10,7,6,"excuse me, sir, would it help if i weren’t wearing underpants?",
6,10,9,0,"man, this sucks! y’know if mom and dad don’t see us on tv after we made them so jealous, i mean, who’s gonna be the losers then?",
6,10,9,2,what?,
6,10,9,4,"ross, we haven’t done the routine since middle school.",
6,10,9,6,was it really that good?,
6,10,9,8,"okay, let’s do it. mom and dad are gonna be so faced!","[they move into a space, and ross points to his eyes and then to hers]"
6,10,9,9,5 6 7 8!,"[they start the routine. however hard i try, i really cannot describe it. you will have to watch it. i’m sorry.] [when they finish, they walk over to the director]"
6,10,9,12,yes!,[they run over to a platform]
6,10,9,20,"i know! hey, you haven’t been practising the routine, have you?",
6,10,9,22,me too!,
6,10,9,24,"ross, i think we should stick to the routine, we don’t wanna look stupid!",
6,10,10,27,"hey guys! you found the presents? chandler, you let them find the presents? great! do you know how long it took me to find you that water purifier?",
6,10,12,0,"we were on the platform, ready to dance the world into the new millennium, and the guy yelled ‘cut!’",
6,10,12,2,"yeah. but of course we had to update it a little bit. hey, by the way, great thinking about catching me!",[to ross]
6,10,12,4,what? we could do it!,
6,10,12,6,"i can do it, okay? come on, let’s go.",[she and ross get up]
6,10,12,8,i can’t do it!,[ross falls into monica’s room]
6,11,1,3,"honey, we have been through this before!",
6,11,1,7,you serious?!,
6,11,1,9,really?!,
6,11,2,7,bye.,[janine exits.]
6,11,2,9,i am so glad you said cooks.,
6,11,2,15,you got it from pottery barn ?!,
6,11,2,18,"rach, phoebe hates pottery barn",
6,11,2,23,"yeah, she hates all mass produced stuff. she thinks her furniture should have a history, a story behind it.",
6,11,2,25,"it’s gotta be one of a kind. y’know like umm, y’know uh, what’s that god awful ceramic fruit bowl she has on her counter?",
6,11,2,29,i’m telling—if you put that in her apartment you’ll never hear the end of it.,
6,11,3,1,"i am so glad you guys got together, chandler and i are always looking for a couple to go out with and now we have one!",
6,11,3,4,yeah.,
6,11,3,6,so do you guys gonna come over tomorrow? i’ll make that pasta thing i was telling you about.,
6,11,3,9,"joey, you don’t have too!",
6,11,3,13,tomorrow!,
6,11,6,0,hey!,
6,11,6,2,the dinner will be ready in twenty minutes. this is so exciting.,
6,11,6,5,what happened to janine?,
6,11,7,3,joey! why is janine not coming over for dinner?!,
6,11,7,7,what?!! what?,[loudly] [quietly]
6,11,7,9,"ugh, i can not believe this! i mean, who is she to judge us? we could not have been nicer to her!",
6,11,7,16,"of course we will, come on we gotta make dinner.",
6,11,7,18,i do not like that woman!,[from the hallway]
6,11,7,20,i am loud!,
6,11,9,1,"chandler, would you like some more orange juice?",
6,11,9,3,i know!!!,[loudly]
6,11,9,9,"well, i’d like to but, i’m not sure we have time to go.",[extremely quietly]
6,11,9,11,we owe you?!,
6,11,9,13,we didn’t give you any money!,"[chandler is motioning, ""no!""]"
6,11,12,3,don’t worry about it.,
6,11,12,6,absolutely!,
6,11,12,9,good night!,"[they go into their respective apartments.] [cut to joey and janine’s, they’re entering.]"
6,11,12,12,"i knew it!! y’know, you’re not so quiet yourself, missy!",[bursting in]
6,11,12,15,all right! you and me! let’s go! right now!,[steps up and points at her]
6,11,12,18,you’d better hope i don’t see you in the hallway!!,[to janine] [they exit.]
6,11,12,24,what did i tell you about the hall?!,
6,11,12,26,"well, i know that would make joey happy, so, i would like that too.",
6,11,12,28,"now come on. well, i’m glad we worked things out.",[they hug like men.]
6,11,12,30,okay.,
6,11,12,32,bye.,[leaves to resume her garbage removal task.]
6,11,12,34,that’s it big girl! come on!,[hearing that] [hits janine in the butt with the garbage bag]
6,11,12,36,you’d better run!,[chasing her] [joey and chandler both come into the hallway.]
6,11,13,4,i cannot believe you broke up with her just like that.,
6,12,1,3,"that didn’t work on mom, it’s not going to work on us.",
6,12,1,14,no.,
6,12,1,16,"well, you tell a lot of jokes!",
6,12,3,1,it’s only you.,[relieved]
6,12,3,5,"so do you think that these pictures—are, are they trying to tell a story?",
6,12,3,7,"well, she’s not going to find them lying in the grass like that.",[they flip through the pages to another picture.]
6,12,3,9,yeah.,
6,12,3,11,"okay, i’ve got a question. if you had to pick one of us to date, who would it be?",
6,12,3,13,me neither.,
6,12,3,15,what?!,
